uniqueIdeaIndex,idea
m2ks9scbirt9n-AIRH-144-1,"The Code & Catch Activity Set, a game that promotes highly active play while also teaching mobility and computational logic. At its core is a smart ball and set of colourful interactive activity cones. Each cone includes a built-in speaker and simple display, pre-programmed to provide challenges and commands that guide children through games that teach computational concepts such as sequences and logical flow."
m2ks9scbirt9n-AIRH-144-2,"The outdoor Quest Pathfinder a toy that blends outdoor play with computational learning. A rugged, weather-proof quest belt comes with GPS enabled quest tokens that can be scattered around a play area, creating a treasure map with pre-set objectives. These objectives teach logical flow and other computational ideas."
m2ks9scbirt9n-AIRH-144-3,"The Indoor Activity Circuit Pro an innovative toy that transforms the room into a learning gym focused on mobility and and computation. The set includes a cushioned, interactive floor tiles and an AI-powered Mission Orb, which gives tasks. The tiles are programmed to light up with different patterns and sequences, teaching computational concepts."
m2ksh7rmn3flg-HMRH-148-1,So one idea for a toy would be to integrate a basketball with computation. Like maybe there's an app that it attaches to the ball that computes the trajectory of the basketball whether it misses or makes it through. And then sends the data to the app so the player can see like the miss and score rates. If they are overshooting or undershooting. It encourages the player to move since it would be super interesting to see the analytics of it since most people don't track it and its bothersome to anyways. You can see progress to which encourages more playing ball which is healthy.
m2ksh7rmn3flg-HMRH-148-2,Another idea is have like this toy robot that the parent can turn on for their baby that rolls to play hide and seek with it. It would would have cameras and compute like the distance the baby is from it and make some sounds to give the baby some hints. It helps encourage movement and exercise for babies.
m2ksh7rmn3flg-HMRH-148-3,"Another idea is to have an app on for kids that encourages exercise. It has a camera, computer vision and kind of do like wiifit kind of thing. It calculates the workout ativities for the kid and in a fun way through games like bowinling, jumping jacks, etc"
m2kspqjuassfc-AIRH-152-1,"In my first idea i actually asked for a product idea i would want, it is a common thing for PC users to have cold hands as they use thier prephirels. And the idea proposed sounds very effective and i would actually buy it if i could lol. It talks about a mousepad i can simply plug into a usb slot and control its temprature, that sounds perfect."
m2kspqjuassfc-AIRH-152-2,"Second idea sounds like a product that would go viral instantly, its hard for me decide aht sort of clothes i would want to buy, and this mirror/screen hybrid will use AR to track my body and fit clothes on me so i can save the trouble of actually physcially trying on these clothes and travelling to these sites to see how i look"
m2kspqjuassfc-AIRH-152-3,A toy that the AI robot recommended to me is the RoboSkate which sounds great. Its a RC skateboard that the teens can do simple programming to and control its movement. The fact it comes with an app to teach them how to do is great
m2kspqjuassfc-AIRH-152-4,"Another toy the AI recommended was the ArtBot rover, which is hoing to be small robot that is again programable by youb teens and it will allow thenm to control its and its arms movement to vreat art."
m2kspqjuassfc-AIRH-152-5,"Another toy it recommended was the TumbleTot express, which will be a ride on train the kids will be on, and they will press simple buttoms and dials that will let them choose the direction and speed of the train. It also allows them to control its sounds"
m2ksrswp9ej71-HMRH-156-1,"My first idea is a toy which I would desribe as an electric kite. It would resemble unique or popular animals. Perhaps some from anime such as the flying bison from avatar called Appa. This would be fun for children as the kite would not rely on it being windy and so children could fly the kite whenever they want, the computation aspect could be an extra remote or the ability to control the animal from a tablet/phonne. There could also be a camera within it and so children could take photos."
m2ksrswp9ej71-HMRH-156-2,My second idea is escape room enclosed within a large box. However rooms and doors can not be opened. Children would have to engage with the rooms through an external screen such as a tablet and figure out the how to escape the rooms. When a room is escaped then there could be another puzzle which must be worked on physically. So essentially you are combining physical and computer in a very fun and engaging game.
m2ksrswp9ej71-HMRH-156-3,"My third idea is a brush, a child who likes drawing or painting can customise and change colours by pressing harder. Furthermore there could be a holographic aspect where a child can say or input what he wants to draw and it will show an image. It could also give instructions on how to draw and give helpful tips, perhaps a mode where when the pen is held it can guide a child to draw."
m2ksrswp9ej71-HMRH-156-4,"My fourth idea is a sort of twist on building blocks, the twist ist that the building blocks  can change shapes and the task would be to make items but the shapes are unconventional, this will be a unique and creative way for children to think out of the box, the computer element will give feedback and at the end show how to achieve the shape."
m2kt5oajxyt5g-HMRH-164-1,A put-it-together programmable race car that has an extremely simplified hand-held coding controller that enables the car to move in certain directions based on the child's inputs.
m2kt5oajxyt5g-HMRH-164-2,A small robot toy that has customizable parts and is controlled via an app that when used can control the robots movements.
m2kt5oajxyt5g-HMRH-164-3,A 'smart' basketball - a basketball with an embedded sensor that when used alongside an app can give the child real-time analytics based on the child's jumpshot and ways to improve. The app can detect the trajectory and arc of the basketball and give helpful pointers to children who are looking to improve their jumpshot.
m2kty1lwudtpx-AIRH-176-1,"Robo-Racer Adventure Bot. A smart robot car for kids combining mobility and computation. Features programmable movement, sensors, LEDs, mobile app, customizable sounds. Estimated production cost: $36-48?unit"
m2kty1lwudtpx-AIRH-176-2,"Smart Pals Coding Critters. Interactive pets combing mobility and computation for kids. Features Modular tracks guiding critters, coding cards for movement commands, app integration for enhanced challenges. Estimated production cost:$28-40/unit."
m2kty1lwudtpx-AIRH-176-3,"A futuristic toy for kids, combining a mobility and Ai-driven computation. Features modular robot parts for assembly, app based AI challenges to navigation. Estimated production cost $42-55/unit."
m2ku4ff1f724x-HMRH-180-1,A toy cute phone that the child would be used for games. It can have sounds that would be singing songs while the child plays a game on it
m2ku4ff1f724x-HMRH-180-2,A toy phone with numbers and alphabets on the phone that would be mentioned out to the child when they press it
m2ku4ff1f724x-HMRH-180-3,A toy car that can move about just with a command by the child with a help of a battery or charge
m2kuwbv23mspq-HMRH-196-1,"The Eco-friendly toy. A toy convenient for the environment, household and your child. It serves the needs of your child with its computing skills and satisfies the parents' imaginations. It can be taken anywhere, at any time."
m2kuwbv23mspq-HMRH-196-2,The Catchy Machine Toy. There is nothing worth a few dollars than this machine toy. It helps your child with its math and exercises. No need to stress about your child lacking behind in school with this machine toy.
m2kuwbv23mspq-HMRH-196-3,"The Classic Moveable Toy. Worry no more parents about your child when it comes to math. The classic moveable toy is here to ease your pain while entertaining your child with math. There is no better word to help your child with math, so get the classic moveable toy today."
m2kvdnawst4is-HMRH-204-1,Voice command animals that move around the room at your command and eat up objects that you can place anywhere and they tell you what they just ate and how many they ate. So the child learns to count and what the names of the objects are.
m2kvdnawst4is-HMRH-204-2,A mat that the child can walk or jump on to the tune of various child nursery rhymes. That can pick up speed or slow down at their command.
m2kvdnawst4is-HMRH-204-3,A car that they can ride on a track and tells them how far they've driven and how many miles it is to various places in the country.
m2kvk1ni70gob-AIRH-208-1,"robo mover kit
customize robot kit where kids build robot program navigation and complete task using a simple coding interface"
m2kvk1ni70gob-AIRH-208-2,"smart wheel playset
create modular vehicles that combine mobility and computation allowing kids to programe movement and respond to interactive track challenges"
m2kvk1ni70gob-AIRH-208-3,"dance and code mat
an interactive mat that combines mobility and computations letting kids program dance sequence through movement while  learning basic coding concept"
m2kvzzodzwr6n-AIRH-216-1,"The StepShuffle smart Dance Trainer. A dance mat designed for kids aged 5-11, that uses computation to make shuffle dancing fun and interactive. The dance trainer has pressure sensitive zones that detects foot placement and timing, connected to a digital interface displaying real time stats and feedback accessible via an app for smartphone, tablet, pc, console etc accompanied by software that incorporates the music/ songs they wish to shuffle to. The trainer offers guided lessons, Rhythm challenges, customisable dance routines. Kids can track their progress, level up and compete with their mates."
m2kvzzodzwr6n-AIRH-216-2,"The IntelliRoll Trainers. Smart roller shoes designed to merge mobility with computation to make an educational but fun experience. Through a smartphone, tablet compatible app kids can access stats etc."
m2kvzzodzwr6n-AIRH-216-3,"The PowerPals ExoSuitis a wearable robotic exoskeleton designed for kids 5-11. This integrates computation with interactive play, it is lightweight and adjustable . The Exoskeleton enhances physical ability with power assisted joints which allows kids to lift slightly heavier objects and increase their agility."
m2kwmxsmjlyz4-AIRH-224-1,A techtugger is a playful and educational tow tow designed specifically for children. The toy combines mobility and leaning for kids
m2kwmxsmjlyz4-AIRH-224-2,A code car is a vehicle for kids that kids use in creating commands of how they want the car to operate
m2kwmxsmjlyz4-AIRH-224-3,Roborider is a coding a coding car designed for kids this blend the excitement of a remote controlled car with basic coding
m2kwtejuyin78-HMRH-228-1,"I would make a remote controlled superhero toy that can move around. It would have an inbuilt AI voice activated calculator to help with maths homework etc. It would also have selectable voices (spiderman, yoda, bart simpson etc) for giving the answers. It could be used as a stand alone toy or a maths aid."
m2kwtejuyin78-HMRH-228-2,"I would make a 'pet' that could follow the user around the house when they activate a fob (or similar) than clips on to their clothing. It would have 'Alexa', 'Siri' or similar AI that could answer any questions the owner has."
m2kwtejuyin78-HMRH-228-3,I would make a 'football player' toy that can walk about without banging into walls etc (similar to those smart vacuum cleaner robot things). It could be programmed via an app to shout out the latest football scores for whatever teams the user has picked.
m2kx819169d0r-AIRH-232-1,"WatchQuest:  A device you wear that lets kids create and complete scavenger hunts in Augmented Reality  by solving math problems or logic problems.  As the kids move around their environment, it tracks their steps and gives clues for the next location based on solving the math challenges OR by physical challenges (10 jumping jacks, run in place for 30 seconds, etc.)  It would be story driven.  They would see the prizes, clues, magical items, etc.. in their real time environment, put there in AR when they look at the watch. This could be played indoors or out, be multiplayer or single player. This would help kids be more physically active while learning math."
m2kx819169d0r-AIRH-232-2,"Doll Adventure AR: a captavating experience combing physical activity, augmented reality (AR) and creative play.  Kids wear smartwatches connected to their dolls and dollhouses, embarking on interactive journeys filled with STEM based challenges.  By solving simple logic puzzles, they unlock real time AR feedback, blending physical surroundings and digital elements.  Outdoor AR markers trigger special quests, pushing children to explore parks and public spaces.  The creative studio lets kids design outfits when they earn points by solving puzzles.  It would have multiplayer allowing them to play with friends, collaborate on adventures which would help with teamwork."
m2kx819169d0r-AIRH-232-3,"Dashbots: Kids build obstacle courses for programmbable robots. to help their dashbot win, kids must run, jump, and adjust obstacles in real time.  At checkpionts they need to solve simple puzzles, counting, match to progress.  Winning races elevates their level unlocking new robots, accessories, and harder puzzles.  the game is single or multiplayer."
m2kxkihecd3pp-HMRH-236-1,"An educational laptop toy which kids can use to learn, it has built in AI technology so kids can use it to learn, its programmed with educational board syllabuses, so you can program it to your specific exam board and it can help you with content. It can also help you test your knowledge."
m2kxkihecd3pp-HMRH-236-2,"a tablet which has AI technology and comes with a pen, parents can use it to create fun educational activities for their children, so things like create a picture of a cartoon character in black and white, so my child can paint it, or create a jicksaw puzzle or something, or you can play hangman on it or games you can ask it to create."
m2kxkihecd3pp-HMRH-236-3,"a tablet which has AI technology and you can use it for bed time stories, so you give an idea to the AI and the AI creates a story which reads it out at night to your child or you can read it, it also has pictures."
m2kxtg5mrcszm-AIRH-240-1,make a toy car with a box shape and add two small tires in front and two big tires at the back for mobility
m2kxtg5mrcszm-AIRH-240-2,create a remote to control the car and apply computation to allow controls work on the toy car at any time
m2kxtg5mrcszm-AIRH-240-3,"the car must be of two colors, the interior must be white and the exterior must be made black so"
m2ky7okcqnegu-HMRH-244-1,"WALKING ENGINE MAN
THIS IS A MAN THAT LIKE TO WALK FOR HEALTH BENEFIT WITH PEOPLE AND HELPS PEOPLE TO STAY FIT WHILE TAKING THEM TO WALK."
m2ky7okcqnegu-HMRH-244-2,"SOLUTION MOVER
IT HAVE ABILITY TO PROVIDE SOLUTION TO PEOPLE AS FAST AS POSSIBLE NO MATTER HOW FAR YOU ARE FROM HIM."
m2ky7okcqnegu-HMRH-244-3,"JUMPING GURU
SHE IS A BEAUTIFUL PRINCESS THAT ALWAYS SAFE PEOPLE FROM HAZARD OR DANGEROUS SITUATIONS WITH FAST RESPONSE AND QUICK THINKING."
m2kywv3fe7rvg-AIRH-264-1,"RoboQuest: A customizable robot toy that children can assemble, program and send on adventurous missions around the house. With a companion app, kids set challenges, guide their robots using visual coding, and attempt to have the robot navigate different courses around the house."
m2kywv3fe7rvg-AIRH-264-2,"SmartRun Racetrack: A modular racetrack where kids build tracks and code cars using an interactive tablet app. They program racetrack layouts, time trials and obstacle courses, enhancing logical skills by optimizing race car speed and layout for the best lap time. Different tracks can be created around the house."
m2kywv3fe7rvg-AIRH-264-3,"Code & Cruise Boat: A sleek watercraft toy that children can program to sail across pools or bathtubs. By entering simple codes on a waterproof touch panel, kids navigate challenges, solve mazes and learn sequencing through aquatic exploration. They program the watercraft to navigate through obstacles or mazes."
m2kz7d6kaxx5j-HMRH-268-1,A remote controlled race car. This car can be controlled with a little remote attached to the car and can move to any direction that is inputed.
m2kz7d6kaxx5j-HMRH-268-2,An Electric Kite. This kite unlike the normal kites will come with an application that controls the distance it can travel and the patterns in which it can move.
m2kz7d6kaxx5j-HMRH-268-3,A Drone Transporter. This toy can be used by kids to move around freely without the danger of getting missing. It will be controlled with an app where its location can be monitored and destinations limited to a specific  geographical range
m2kzbef34eg2x-AIRH-272-1, Movable Tech would be the name of the toy. The idea is to make a toy which can move about but has the ability to do simple calculations withs children.
m2kzbef34eg2x-AIRH-272-2, Smart Compu would be the name of the toy. This idea is to produce a smart toy with the ability to move and help kids with simple maths.
m2kzbef34eg2x-AIRH-272-3,Compu Sprinter would be the name of the toy. The basic idea is to design a toy that can do general addition and subtraction by kids and at the same time can walk.
m2kzn2g6cugpm-AIRH-280-1,"A programmable mini robot car that children can customize and race, it uses a basic drag and drop coding interface on a connected app to teach computational thinking."
m2kzn2g6cugpm-AIRH-280-2,"A smart skateboard equipped with pressure sensors and small embedded screen. As kids ride, the screen displays challenges and math problems linked to their speed and movement."
m2kzn2g6cugpm-AIRH-280-3,"A light weight drone equipped with camera and AI based for mystery solving games, children program flight paths and use onboard clues to solve virtual mysteries"
m2l0bnapypzx5-AIRH-296-1,"Kinetic Maze Builder: A modular playset for creating moving mazes with motorized elements. Using a simplified digital interface, children design and test various maze configurations for remote-controlled balls. The set helps kids understand cause-and-effect, spatial reasoning, and basic coding logic by modifying speed and direction to solve creative maze challenges. This type of toy not only promotes active play but also nurture essential skills in computation thinking, and critical problem solving, and creativity."
m2l0bnapypzx5-AIRH-296-2,"Robo-Rover Coding Kit: A programmable robt car that encourages kids to learn coding by controlling its movement. Equipped with an intuitive app featuring drag-and-drop coding blocks, kids can send the rover on missions, explore different terrains, and learn basic robotics principles. The Robo-Rover also features customizable attachments for unique challenges and encourages problem-solving."
m2l0bnapypzx5-AIRH-296-3,"Sensor-Enhanced Drones: Lighweight drones with built-in senosrs that allow children to program flight paths and perform tricks. The intuitive companion app provides interactive puzzles and challenges. As children progress, they learn navigation and computational logic skills, while witnessing immediate actions from their codes via drone maneuvers."
m2l0fym75g4hi-HMRH-300-1,"A computerised handheled pet that can be programmed to perform tasks like a real pet. For example, a dog or cat. Perfect for children that live in pet free living accomodations or somewhere it is impractical to have a real pet."
m2l0fym75g4hi-HMRH-300-2,Car track - A game where you can make your own racecourses and race cars. Can be handheld to ensure mobility. Can use controls to design to your own liking.
m2l0fym75g4hi-HMRH-300-3,Interactive roller skates. Able to change the design of the roller skates whenever they want. Can follow an app to teach how to do tricks or to try and follow a course.
m2l0hgc88s4dz-AIRH-304-1,"This idea is called the Number Nudge Scooter and it would feature a Math Charge mechanism. Before being able to ride, kids must solve a set of math problems that appear on a  panel located on the handlebars. Solving a set of the problems correctly would charge the battery up giving up to 15 minutes of riding time. This educational approach would incentivize the child to do well on the math problems and get them engaged with learning before being rewarded with the mobility aspect of the toy. In addition, there could be bonus charge time awarded if the child does exceptionally well, answering all of the questions correctly."
m2l0hgc88s4dz-AIRH-304-2,"This idea would be called the Computation Kite, which essentially is a folded up kite, folded up many times, and children use an app or handheld device to solve math problems which progressively unlock the kite allowing it to unfold, section by section based on getting the correct answers."
m2l0hgc88s4dz-AIRH-304-3,"This concept would be called the TechnoTile Adventure Mat featuring a large grid like mat, place on the floor, with LED lights and painted adventure scenery featuring pathways and obstacles. Kids would solve math problems to propel themselves one step further along the grid until they reach the final/ending tile, which in a twist can move around the mat and is highlight by LED lights. The kids have to make it to the final spot before it moves again."
m2l0kp116l7vl-HMRH-308-1,"My first idea is a toy shaped like an icecream truck with enough space for a child to move around, similar to a mini house. In this icecream truck, there are compartments for the child to put various objects e.g. fake fruit and veg and a functional till so that the child can imagine having their own business."
m2l0kp116l7vl-HMRH-308-2,"My second idea is similar to tetris, there is a wooden square with tetris shapes included and a UI which randomises on select of a button to how the pieces should fit. The child has to place the tetris shapes in the selected order in order to 'win'."
m2l0kp116l7vl-HMRH-308-3,"My third idea is a computer animal, which comes with several different parts for customisation, for example, a child could make their animal have a circle bear head, a triangle tail and a star shaped body, or a star shaped head, as long as the pieces connect together, it can be made. The animal is similar to a furby, the child can teach it to talk and walk."
m2l0u2qdpmwy0-AIRH-312-1,"A computerised, AI game box that features bright colours, audio and visual instructions to facilitate a family game where the first person to bring back an item that matches the image/audio description on the box wins. The AI can visual match the brought back object to the criteria. Eg: colour based for young children (e.g: something blue) with increasing difficulty categories for older age groups (e.g.: something that's recyclable)."
m2l0u2qdpmwy0-AIRH-312-2,"An interactive robotic animal designed to educate children on pet care responsibilities through lifelike experiences. Integrates artificial intelligence and sensory technology to mimic real animal behaviours, characteristics and appearances. It requires regular activities such as walking and comes with an app to track health metric and happiness levels."
m2l0u2qdpmwy0-AIRH-312-3,"Robotic Terrain buggy, that has all-terrain wheels and can be navigated by children through an app and GPS to let them program the buggy to travel where they'd like to explore. Parental controls on the buggy allow them to set the radius the buggy can explore within. and it supports coding and exploration"
m2l12ymf2xd96-HMRH-316-1,Design a toy car that would have it's mobility and computation working hand in hand to enable autonomous vehicles to navigate complex environment
m2l12ymf2xd96-HMRH-316-2,"A super toy car that kids can control using a computer program to avoid obstacles and even perform fun tricks. It will blend the excitement of remote control cars with educational aspect of programming, offering a fun and interactive way for kids to learn mobility and computation."
m2l12ymf2xd96-HMRH-316-3,"A toy that would allow kids to customize car movement, speed and even create obstacle courses for it to navigate through"
m2l14q7pio3cw-AIRH-320-1,Robo-Adventure Scooter; can be ridden as expected but also used to code whilst zooming around. It has coding quests and LED-lit adventures. Perfect for those who want to both ride and learn.
m2l14q7pio3cw-AIRH-320-2,"Smart Ball Roller; which combines movement and problem solving through interactive play, by programming a ball to navigate mazes they build themselves. This helps children learn computational basics and encourages creativity and logical thinking."
m2l14q7pio3cw-AIRH-320-3,"Galactic Glider; a wearable jetpack which is controlled by kids' movements. It includes sound effects and an interactive console, where imaginative storytelling boosts young creative minds."
m2l14q7pio3cw-AIRH-320-4,Whizzy Wheels Rover; a remote controlled vehicle with snap-on attachments for limitless missions. It can be programmed via app challenges and carry out treasure hunts to obstacle courses.
m2l172b8o8c38-HMRH-324-1,An animatronic device that identifies what a child is holding or pointing to and describing that object in specific detail based on the age and perspicacity of the child.
m2l172b8o8c38-HMRH-324-2,"A gyroscopically stable skateboard that could help the child learn how to ride it without falling off by computing speed, angle, etc."
