uniqueIdeaIndex,idea
m2kl3701ioyue-HMRH-4-1,"A pre-programmable electric skateboard which would allow kids to enter how many meters they want to travel before stopping, climbing on the skateboard and simply pressing go."
m2kl3701ioyue-HMRH-4-2,Hide-and-seek timers.  Each kid who hides wears a device which starts timing once the game begins.  The seeker will then rush to fund the kids who are hiding and each time they are found the timer will stop.  The kid with the longest accumulated hiding time after 10 rounds is the winner.
m2kl3701ioyue-HMRH-4-3,Race timer.  A kid friendly wearable device which will time how long a kid takes to run a certain distance.
m2kl678edtegg-AIRH-8-1,"Toy shop
Combines mobility and computation as children can stand and serve customers and stock the shop using pretend food items. For computation, there can be a till that allows children to calculate the price of the food."
m2kl678edtegg-AIRH-8-2,"Smart construction set 
use motorized components such as vehicles. Children can learn coding through creating sequences that make the vehicles move. hands on innovation"
m2kl678edtegg-AIRH-8-3,"exercise mat
with embedded sensors and led lights to create a fun exercise experience. Children could follow sequences on a mat such as maths games where they have to step on squares that are a certain number"
m2km9mn7fdjot-HMRH-12-1,"The first idea is a scooter which the child powers up by completing fun maths activities on a bluetooth linked phone or ipad. Completed tasks earn battery life, and bonuses earn sounds and lights."
m2km9mn7fdjot-HMRH-12-2,"This is a pogo stick which bounces higher the more maths tasks are completed, using a voice input. The stick is auto stabilised to avoid children falling off."
m2km9mn7fdjot-HMRH-12-3,"This is a car simulator, which goes on a virtual journey as part of a quest story, based on the geography curriculum. Children complete tasks and answer quizzes alongside a virtual animal companion."
m2kmaynyn75op-HMRH-20-1,"wheels in motion children can adapt ride- on cars to explore their surroundings ,eg a car that is able to move around"
m2kmaynyn75op-HMRH-20-2,speed in motion.one can design a well structured toy maybe a jeep toy car and the kid can play around with
m2kmaynyn75op-HMRH-20-3,also a one can have a toy like a bicycle that uses speed to move around and a child can comfortably use it
m2kmgxflc8x64-AIRH-24-1,"MathQuest: A scavenger hunt where children receive math clues to locate hidden items, in a large area, like a field. Like a normal scavenger hunt, they answer clues to get the prize!"
m2kmgxflc8x64-AIRH-24-2,"The Puzzle Racer: A toy car that runs on a track, powered by answering maths problems. The child will use a remote control to drive the car, but it only accelerates when they solve a maths question on a remote screen/app. If they fail, it decelerates. The car will always go at a speed, faster if questions answered correctly, slower if answered wrongly. This can make time trials between friends, racing to get the best time!"
m2kmgxflc8x64-AIRH-24-3,"Math Tag: An active play toy that combines the classic game of tag with interactive educational math challenges. To unfreeze, they have to solve the problem. The game ends after a time limit, or when all people are frozen."
m2kmrcansixgg-HMRH-28-1,"My concept is a calculator in the form of a car for simple mathematical computations, including addition and sbtraction in a base version for younger ages, say 5-6 and extending to include multiplation and division for the version for older kids (till age 11). The car needs to be a decent size to be able to incorporatte easily accessible buttions in a simple calculator interface on the top of the car. The comptations which are entered (eg, 2+4) are then visible on an lcd display in the windscreen of the car. After pressing enter the answer is displayed. Then the car moves to give a visual representation of the answer. For, addition it (for the example of 2+4) it will move in a straight line counting counting up to 2 then display the + sign and start moving again counting to 4 and finally display the answer of 6. This will give a visual representations to youung children learning to cope with such mathematical computations what length/distance different numbers and their combinations represent. Similarly, the othjer computations will be demonstrated as follows. For subtraction the car will move forward by an arbitrary length for the first number and then reverse to represent the subtracting number, again displaying the numbers on the screen counting the numbers as it moves in either direction. For multiplication, the car would move forward by the length of the first number then move right by the lenght of the second number covering the sides of a square of a representative rectangle with such dimensions, and then finally trace out the area of the rectangle by moving up and down along the are of the shape as it counts the answer to the multiplicative solution. For division, the car would move in a straight line to demonstrate the lenght of the first numher then pause to display the division sign and number to be divided by, before driving back the lenght pausing along the length of the solution to the proble, eg for 6/2 the car would drive forward by 6 then do a loop to point backwards and then drive 3 (all the while counting up) then pause before once again driving a length of 3. Different animations on screen at the end of each operation or between driving the initional equation instructions and tracing the solution can make it more lively for kids. Similarly, a mode to test kids development can first drive the appropirate ditances and then request a solution to drive the appropriate distance. If the answer is correct then an animation can provide confirmation, if not then the car can drive again to trace out the ocrrect path an ddemonstrate the visual difference in the solution."
m2kmrcansixgg-HMRH-28-2,"A circular shaped dial game with a core circle displaying mathematical operations including addition, subtraction, multiplation and division, a second outer ring with numbers between 0 and 1, followed by another similar 3rd outer ring. The combination of the first circle and the two subsequent rings will define the mathematical operation. FOr example, 2+5 will be instructed as + chosen in the core circle followed by 2 in the ring immediately adjacent to the circle and then 5 in the second ring. Two further rings will then allow the player to choose the answer, in this case 05 or possibly 5 followed by a blank option in the outer most ring. The core ring (which should be a dynamic lcd display) will then proivide confirmation of whether the response is correct and what it shoud in fact be. The compact circular design of the entire toy would make it easier to carry around."
m2kmrcansixgg-HMRH-28-3,"A ball with an lcd display, a bit like a magic 8 ball. The game can be played by a single player or between two players. The first player chooses a number on the screen (perhaps through a simple scrolling mechanism). The ball is then shaken by either the first player or handed to the second player to shake, if played amongst two players. This generates a mathematical operation (addition, subtraction in which case a smaller number must be chosen, multiplication, but no division to avoind dealing with fractional values). Next a player must enter a new number. The game can also be played against an automated oponent to make the 2nd numeric selection. The player must then choose their answer on the screen from the scrolling menu after which the ball will provide a confirmation along with an engaging message to have a fantastical explanation for what the number might represent."
m2kmwhkit165s-AIRH-32-1,"Botanical Explorer Drone, is controlled through a tablet and can record environmental data, including temperature and plant life, which is stored and analyzed."
m2kmwhkit165s-AIRH-32-2,"Smart Dance Mat, is an interactive mat with pressure sensors and LED lights, which allows children to follow dance routines displayed on the smartphone or tablet screen that it is connected to. It offers points to the user based on the creativity and complexity of their choreography"
m2kmwhkit165s-AIRH-32-3,"Smart Backpack, is a motion sensor, LED lights and screen equipped children's backpack, which encourages physical activity. It offers challenges to children like scavenger hunts, through a connected app, to help them stay active"
m2kn5mewjsocr-HMRH-36-1,"Have a small tricycle that a child can sit on and ride. The tricycle can calculate the distance the child has gone, so they are able to see how far they went. It also has a timer on it, so the parent can time their exercise sessions."
m2kn5mewjsocr-HMRH-36-2,"A skateboard that has the feature of turning up or down the resistance, so that the person using it has to use their legs harder to move. The skateboard would have a built-in resistance feature so that it can be adjusted by either an analog dial or a digital button."
m2kn5mewjsocr-HMRH-36-3,"Rollerblades that have a small motor inside them to assist with going uphill. This will assist children with mobility issues but still want to partake in the activity. The skates have an adjustable dial to assist with the motor's strength and have a digital display that shows how much of the battery is left, and how long the child has been using it."
m2knbcej8viz5-AIRH-40-1,"Math Adventure Mat: A large, interactive mat featuring different mathematical challenges. It includes hop-scotch-like sections with arithmetic problems to solve by stepping or jumping. The mat lights up or gives sounds when a child steps on the correct answer, encouraging movement and cognitive processing."
m2knbcej8viz5-AIRH-40-2,"Safari Math Adventure: This board game uses both digital and physical components to keep your child's interest by combine math learning with animal encounters. Players use a tablet with an interactive application that explores the physical map you have at home. This is a safari park that is filled with various animal habitats. As the child moves across the board, new and exciting problems come up such as counting or simple arithmetic challenges. These allow them to collect rewards and advance in the board. This encourages physical movement and also boosts math skills, all while engaging with a fun, animal-themed adventure."
m2knbcej8viz5-AIRH-40-3,Art Bot: It includes a special set of pens and paper that interacts with a tablet. The Child draws pictures and/or designs with conductive ink that will allow the app to scan and transform them into digital commands. These commands allow children to create their characters or scenarios while they solve arithmetic problems. This enhances STEM learning and bridges the gap between art and science while teaching your child mobility and computation.
m2knhks2fftro-HMRH-44-1,"The Olympia, a durable and lightweight bracelet that can be worn like a watch. The Olympia tracks how many steps you have taken, how fast you moved in 24 hours, and how many times you have jumped. Awarding virtual badges to kids who complete daily, weekly, and milestone challenges. Plays sounds and lights up when challenges are completed."
m2knhks2fftro-HMRH-44-2,The Wild Bat combines the fun of a traditional baseball bat with technology. It will challenge you to perform better swings and give the child feedback with sounds whether they are improving their swing or not. Adjust the challenge indicator on the bottom of the bat to challenge yourself to make even more powerful and more difficult swings.
m2knhks2fftro-HMRH-44-3,"The Matrix Ball appears to be a standard ball at first. But, it comes with a powerful tracker that will track how far it has been thrown, how fast it has been thrown, and how many times it has been bounced. Providing the fun of a standard ball, while enabling the child to set goals and compete with themselves."
m2knu3ylg2r71-AIRH-48-1,"Introducing the velocity pro remote control race car, a cutting edge toy for enthusiasts and tech users.this cutting edge controler with built inled display that shows real time , speed and distance data, and computing the distance and speed into the controler gives the user access to the car."
m2knu3ylg2r71-AIRH-48-2,"introducing the morphblade, a revolutionary weapon designed for versatility and adaptability. the morphblade integrates advanced nanotechnology to allow transformation into various weapons through a voice activated computation system."
m2knu3ylg2r71-AIRH-48-3,"meet melody grace, an enchanting doll with a taste for dance and music, with her life like features and dressed in a flowing dress she can dance to any song played on her playlist and is accessed through voice activation computation."
m2ko40aj5vygf-AIRH-56-1,"A portable backpack, which can be carried anywhere and then used to type and use as a computer on the go. Ideal for travelling with children."
m2ko40aj5vygf-AIRH-56-2,"A scooter with detachable handlebar tablet. It can be used for navigation purposes, but also as a game to collect treasure, prizes and points along the journey."
m2ko40aj5vygf-AIRH-56-3,"a mobility robot, to walk alongside children, matching their pace. It allows them to ask questions about nature and the outdoors as they go along, learning about plants and animals."
m2koag88kjnjl-HMRH-60-1,Musical keyboard scooter. This is a four wheeled scooter with handles. In addition to the traditional scooter it also has musical piano keyboard like notes on both the handles and foot pads which respond to the childs movement and hand and foot pressure and to directional changes.
m2koag88kjnjl-HMRH-60-2,Percussion trampoline. This is a large 14ft trampoline. In addition to the traditional trampoline bouncy pad it has also integrated drum pads. The different drum notes are drawn onto the tampoline bounce pad and represented with circles. When the child jumps on the pad a drum note plays.
m2koag88kjnjl-HMRH-60-3,"Pirate/Parrot themed ride on. This is a ride on that has wheels which are hidden and looks like a pirate ship. There is a parrot mounted on the ride on, atop a crows nest. The parrot interacts with the child. The parrot can respond to questions that the child asks it."
m2kofzy1caymw-AIRH-64-1,A trike that allows the child to go for a predetermined distance based on the child inputting a a solution to a problem of significant difficulty.
m2kofzy1caymw-AIRH-64-2,"A trike that logs workout stats for the child as they ride, based on numbers inputted by parents upon setup of the trike."
m2kofzy1caymw-AIRH-64-3,Trike that allows educational content to be played on the screen generated by AI based on the location of the trike and its surroundings.
m2komooeizo00-HMRH-68-1,"A cross between a step-counting watch and a walkie-talkie, perhaps. Basically a wearable device that tracks a child's movements and connects to his/her friend's devices and info so that kids can compete with one another to see who has the most steps. And to make it more interactive, the children could talk to each other through the watches and cheer each other on and watch in real time. So you could essentially race someone who is across the country."
m2komooeizo00-HMRH-68-2,"A handheld device which contained an AI smart friend or learning buddy that allowed kids to ask questions about the world around them in real time. The device could connect via Bluetooth to some sort of wearable - a pair of glasses, for example. So a kid could look at something while wearing them and say, hey, buddy, who invented this machine? or hey, friend, how do you say the name of this vegetable in spanish? TO make it parent-friendly, kids could get points for asking questions which are designated as productive or educational that could either result in some in-device reward like a game or just to keep track for parents' knowledge. So, a parent could say that a kid could go to the movies this weekend if he gets 100 points this week with his buddy. Fun for kids, but parents know that they are actually getting some fun use out of the device, too. For kids who don't like glasses or already have glasses you could use a watch, headband, necklace pendant, etc."
m2komooeizo00-HMRH-68-3,Smart sneakers. So kids shoes that have been equipped with AI that is geared towards movement-related tasks. So it could play games such as lighting up each foot in a certain order and the kid has to stand on that foot (think of the game Simon but instead of colors/tones it is different foot movements). It could also contain GPS that could guide the child to a safe place if he ever gets lost - so in case of emergency the shoes could see where the child is and literally tell him where to walk to get to the nearest designated safe space or a meeting place with his parents.
m2koqih96nbcw-AIRH-72-1,"compute path blocks: building blocks that light up or make sounds based on the sequence of assembly, introducing sequential logic"
m2koqih96nbcw-AIRH-72-2,logic loop hoverboard: an electronic hoverboard that children program with route planning app to navigate paths autonomously and to perform tricks
m2koqih96nbcw-AIRH-72-3,sound step mat: a interactive floor mat that children could program to create different sentences that play words from the phrase as they step in a sequences to complete that sentence
m2kpjqg83ntee-HMRH-84-1,A DIY vehicle kit where children can assemble and program a small car that moves based on input on a mobile device
m2kpjqg83ntee-HMRH-84-2,A DIY robot with self-assembly parts and can be programmed to move around and interact with other robots if possible
m2kpjqg83ntee-HMRH-84-3,A racecar that moves based on solving math challenges and each correct solution controls the vehicle's movements. The difficulty of the challenges can be adjusted.
m2kpnb3v6ate1-AIRH-88-1,A small robot that is programmable to do small tasks and perform light computations. The robot also roams around your house with small wheels.
m2kpnb3v6ate1-AIRH-88-2,A toy that uses augmented reality to do simple math problems. You can point at a white board with a math problem and the toy will solve the problem verbally.
m2kpnb3v6ate1-AIRH-88-3,"A etch a sketch like toy where it generates math problems with varying degrees of difficulty to help children with math. When you shake it, a new math problem appears."
m2kpnb3v6ate1-AIRH-88-4,"A pair of skates that tracks movement speed, distance, average speed, etc.. and reports these numbers at the end of each use."
m2kq1r3kyg10j-AIRH-96-1,"A Robo-Explorer Backpack engages kids in learning with sensors and a screen, teaching about surrounding with GPS and augmented reality."
m2kq1r3kyg10j-AIRH-96-2,A Code-and-go puzzle mat which is a educational toy blends mobility and computing in an engages way without overwhelming the child with complex technology.
m2kq1r3kyg10j-AIRH-96-3,"Imaging a smart adventure belt, for the kids which will be a interactive badges that teach science and geography as a kids move and also computing."
m2kqbn6eqho03-AIRH-104-1,"The Math rover, a smart educational toy featuring a friendly animal design, aimed at children age 6-10.  It has wheels for maneuvering and a digital screen on its back.  When turned on it challenges kids to solve math problems and it can be interacted with by voice or touching buttons.  Once the correct answer is found the rover celebrates by making a fun journey around the room making math both fun and interactive."
m2kqbn6eqho03-AIRH-104-2,"The math rover that can move around on wheels and has a digital display screen with math problems to be solved and interactive features and which does funny dances and movements when problems are solved and also reacts to the environment it is in.  It also has customizable adventure modes where it can embark on themed missions such as a treasure hunt or space exploration.  Each mission has an almost infinite number of alternate paths with math puzzles and logic puzzles tailored to the theme.  It integrates augmented reality through a companion app that overlays digital landscapes bringing the toys adventure to life.  It will also include modular add-ons such as wings or toolkits each unlocking new math topics or challenges.  There can also be a create an adventure mode allowing kids to create their own personalized missions, which could also be uploaded for others to try allowing for sharing missions and infinite possiblities."
m2kqbn6eqho03-AIRH-104-3,"The Math robot that has environmental interactivity with sensors such as infrared and ultrasonic to detect and respond to its surroundings.  It can have a discovery mode where it explores the room and identifies obstacles and reacts with appropriate behaviours such as pausing, reversing etc.  It could also come up with puzzle that are relevant to its surroundings, math puzzles/ logic puzzles that include what it can 'see' and where it is to allow for movement to be based on answers and also to encourage the child to interact and learn at the same time.  If it also has a camera and have basic facial recognition it can respond with emotions appropriate to people and situations and the answers given to its puzzles.  It would have a digital interactive screen for kids to use to complete the puzzles.  It can also respond to environmental changes such as lighting up when the room is dark or responding with noise when certain words are said.  It can respond to puzzle answers with making them easier or harder depending on how well the child does.  It can use the environment and people around them to make up puzzles and allow the child to interact in a more meaningful way to encourage them to want to learn."
m2kqksco9usyo-HMRH-108-1,"Doodle drone: a small drone that children can control while flying. it features a built-in marker that draws shapes or pattern in the air, encouraging artistic expression and spatial awareness."
m2kqksco9usyo-HMRH-108-2,"Code-A-Pet: a programmable robotic pet that moves and interacts with kids. Children can code its actions and responses through a simple app, promoting creativity and computation thinking."
m2kqksco9usyo-HMRH-108-3,"storytelling scooter: an electric scooter that narrates stories as kid rides. children can choose story theme through a connected ap, encouraging imaginative play and physical activity."
m2kr3x5fa8zii-AIRH-120-1,counting jump rope with built-in sensors to track each jump. the handgrips will have LED lights and be colorful and track each jump.
m2kr3x5fa8zii-AIRH-120-2,fetch and sprint toy. a compact launder that uses adjustable spring mechanisms to shoot small foam ball at varied distances.
m2kr3x5fa8zii-AIRH-120-3,"bounce and count wristband. a wearable toy that combines an elastic tether with a soft, lightweight ball. the wristbands features a built-in sensor and digital display. colorful LED lights on the wristband light up with every bounce."
m2krc44diqjdn-HMRH-124-1,"A robot dog that performs tricks based on math questions. The robot dog asks a question that the child must answer. It then calculates the correct answer and if the child's answer matches the robot dog's correct answer, the robot dog performs a trick."
m2krc44diqjdn-HMRH-124-2,"A push cycle, like a tricycle, that calculated how many steps a child has taken for a certain period of time, and when the time is up, it asks the child how many steps (pushes) the child has taken. If the child get it right, the push cycle turns on an electric powered motor that let the child ride around (slowly) for a limited time award."
m2krc44diqjdn-HMRH-124-3,"A Pokémon like digital game that uses geolocation (limited to inside the home) to create a scavenger hunt where the child answers match questions to advance toward to goal, with each goal awarding a digital trophy that you collect."
m2krx18vgzu5l-HMRH-132-1,compact toy to get a child moving. it will have a computation aspect to it but it will be as if it is not there.
m2krx18vgzu5l-HMRH-132-2,a theme around sports and spies. trying to trick the child into exercising and complex thinking at the same time.
m2krx18vgzu5l-HMRH-132-3,the computation can have modes where there are ranking with other kids and the missions get harder and harder as they progress.
m2ks0g0nw1gtu-AIRH-136-1,I have come up with an idea that combines mobility and computation to help children have fun. This includes a  mat which is touch sensitive where children will be timed to press down the correct answer to a question that has been asked. Such as a mathematical question
m2ks0g0nw1gtu-AIRH-136-2,Another idea that i have is a pair of shoes which come with an app that allows the child to be able to meet their step goals and meet their favourite character on the app that wirelessly connect to the shoes
m2ks0g0nw1gtu-AIRH-136-3,Phone/tablet application which involves the history of the users town/ city that they live in and when they visit these places they are given badges on the app
m2ks6p2vp4lbs-HMRH-140-1,"Mobility and computation works very similar, when it comes to science and data. Both enables many innovative and also transforms our daily lives"
m2ks6p2vp4lbs-HMRH-140-2,Mobility helps you to get some services and also resources such as applications and mobile devices to function very well
m2ks6p2vp4lbs-HMRH-140-3,"Computation helps to execute the instructions, which helps data to perform tasks and also enables and its operations including data and science stimulation"
