uniqueIdeaIndex,idea
m2m6fx0h6did3-HMRH-468-2,"Rollerstomps is a concept name for rollerblades with retractable wheels that could only be activated if the user is able to stomp the right number that the blades want. Once successfully worn, the shoes will speak and ask a question regarding math and the user must correctly stomp the right answer for the wheels to be used."
m2m6fx0h6did3-HMRH-468-3,Wheelon is a concept name for shoes with a calculator on the tongue of it instead of laces and the user can a number to tighten the shoes instead of tying it.
m2m6mu66h4ds5-AIRH-472-1,"Smart Exlorer Bot. A toy that combines mobility and computation to enhance learning and fun. Equipped with a mini computer, the EXPLORER BOT can be programmed via a user friendly app to perform tasks"
m2m6mu66h4ds5-AIRH-472-2,Code & Roll Racer: this sleek aerodynamic vehicle comes with built in sensors allowing children to program its speed and direction through drag and drop coding blocks
m2m6mu66h4ds5-AIRH-472-3,"RoboPet: This unique robotic pet moves like lifelike gestures, thanks to series of carefully calibrated motors and wheels. children can program their RoboPet using very simple coding interface on a tablet."
m2q8w0r5yul4k-HMRH-484-1,Tablet speller. Learn the basics for your child to start at a young age. A fun way to get a headstart in life.
m2q8w0r5yul4k-HMRH-484-2,Speed and touch - hand eye corodination to teach your child - patience and awareness. Sharpen up their motor skills.
m2q8w0r5yul4k-HMRH-484-3,"Melodic sound test - testing scales, harmonies and basic musicalilty undersstanding. The best way to get your child into music by testing daily to understand and learn."
m2q8z0h73hbro-AIRH-488-1,a robot - children can learn how to put a model together (computation) and learn about mobility from the hinges and ways it moves. it has different sheets of terrain to move across which teaches them different ways movement can be impacted
m2q8z0h73hbro-AIRH-488-2,a simpler version of the robot - going back to basics with simple building blocks similar to train sets - children get to plan out routes and signals which will dictate how fast and which direction the vehicles can travel in
m2q8z0h73hbro-AIRH-488-3,a maze - children have to build a maze around a ball and the goal is to get it out - this teaches them computation to ensure the maze does allow the ball to get out and mobility to actually get the ball out after it has been built.
m2q9fpuemkfa7-HMRH-500-1,A scooter which has a small device attached to the handlebar which is able to calculate for example how far they have gone or how long they have scooted for like a fitness tracker. They can be set challenges using it as it would attached to an app to earn rewards etc... Parents could use it to set movement targets and they could earn e.g. screen time.
m2q9fpuemkfa7-HMRH-500-2,A toy which replicates the scanner adults use in the supermarket when they do their own shopping and then scan to do self checkout. Children could scan things at home - moving around and then calculate the cost of their shopping etc...
m2q9fpuemkfa7-HMRH-500-3,A ball which is also a calculator. It could set you a challenge for how many times you bounce it e.g. Can you do a thousand bounces? How many more bounces to get to 500? etc.. You can also use it as a regular calculator.
m2q9hzlunqwx7-AIRH-504-1,"a robot dance instructor. robot would perform a range of dance moves, teaching children different dance move, it would have pre programmed dances but also would be able to hear a song and show some dance moves to go with the beat and timing"
m2q9hzlunqwx7-AIRH-504-2,"robotic pet, a child could use an app to learn about programming and get the Pets to complete actions like sitting and speak, pet will be voice activated but the child will need to learn the code"
m2q9hzlunqwx7-AIRH-504-3,remote-controlled car with enhanced mobility and smart technology for a more interactive experience. equip with sensors for obstacle detection. incorporating GPS  for tracking and navigation. with a built in camera for first-person view
m2qacltch9ha0-HMRH-516-1,"My first idea for a toy is a ball with an embedded rectangular screen that calculates how many inches or feet it has rolled by the time it stops rolling. When it's rolled backwards, it subtracts, but if it rolls forwards, it adds to the already measured value."
m2qacltch9ha0-HMRH-516-2,"My next idea is a dentist game where the kid is the surgeon and has to remove pieces of the body that don't belong, like a growth. There is a certain number of pieces that are removable each round and are internally counted, and the moment that the child pulls off a wrong piece, the game freezes and resets."
m2qacltch9ha0-HMRH-516-3,"My final idea is a game where small figure (doll or action figure) has jumping ability via a sensor. This toy is only able to jump if it detects the whole body of a child has jumped next to it or within range. If the child jumps twice, so does the toy, and it says the number aloud good job! every time it reaches a total of 5 jumps, and continues to repeat this action in 5 jump increments."
m2rlhq0xp4rm3-HMRH-524-1,"An abacus mounted on a large toy truck. The beads of the abacus would be electronically linked to sounds. a screen would offer a sum to solve, and when the child puts a correct sum together they get a fanfare of noise, and figures in the cab of the toy truck would clap."
m2rlhq0xp4rm3-HMRH-524-2,"A gizmo with a camera and a screen. The child will go on a walk (with an adult, of course) and be asked, via a message on a screen or a voice, to estimate something nearby - the number of leaves on a tree, or petals on a flower, or bricks in a wall. Then they would take a picture, and the machine would compute from the picture the (approximate!) correct number, andreward them with starts if they are near the correct number"
m2rlhq0xp4rm3-HMRH-524-3,"Put an I spy type App on their phone (or they can borrow an adult's phone). They have to see a certain number of things, (EG letter boxes or blue front doors) and record their locations on the App. They could then be asked how far they think they have walked in executing this task, with rewards for an accurate estimation"
m2rlw3h1kag59-AIRH-528-1,"An AdventureCode Balance Board. Featuring a sturdy nonslip surface with bright child friendly colors to captivate interest. Children use an accompanying code to solve coding challenges by adjusting their body position to complete circuits on the board. As they shift balance, they activate specific lights or sounds, connecting physical movement with computational logic. The board can integrate basic pattern recognition for younger children and complex programming challenges for older children"
m2rlw3h1kag59-AIRH-528-2,"The Quest Rover Adenture Kit. It combines walking, adventure and computation. The kit includes a durable, interactive rover with large wheels and a lightweight wearable device the child can strap on. The child explores outdoors, and the rover prompts the child with sounds or lights to make decisions on path or obstacles to overcome. For younger children, the adventure involves choosing colors, shapes or directions and solving simple puzzles along their journey. For older children the kit is more advanced, with a built in high resolution camera and augmented reality software that projects virtual challenges onto the child's path, visible via a compatible device or screen."
m2rlw3h1kag59-AIRH-528-3,"The 'Eco-Explorer Coding Drone is a toy that combines outdoor exploration with computational learning. The toy incorporates dynamic missions that require physical engagement with the environment. The drone can be programmed to drop clues or small tokens at various outdoor locations. Kids must physically retrieve each item by hiking, running or biking to the points before progressing to the next level. This engaging hands-on experience encourages kids to explore the outdoors, inspiring curiosity about nature while fostering problem-solving skills through interactive coding adventures."
m2rnvhsvt6vu1-HMRH-532-1,"Calcucat. This is a robotic can which kids can program to act like a real pet cat using simple commands, inputted from their phone, helping them to learn the basics of computer programming in a fun way."
m2rnvhsvt6vu1-HMRH-532-2,"Ballerindy. This is a 21st century update to the beloved 'Ballerina Sindy' doll of the 70s and 80s. Ballerindy  is a robot doll can be programmed using simple commands to carry out real dance moves and to music composed by kids on their phones, teaching them about the basics of programming as well as music and dance. There would also be a market for the doll amongst people aged 40+. who remembered the original with fondness."
m2rnvhsvt6vu1-HMRH-532-3,"Voyager. An online phone game for kids, powered by AI that might also be incorporated into a smartwatch device. Kids could take part in daily challenges and scavenger hunts where they use this to 'count' a target number of objects during any given day by holding their phone or device up and taking pictures of objects that the AI would count. They could play 'beat the AI' and gain extra points for counting things themselves.  if the AI counted incorrectly. This would combine exercise as the kids would need to move around to find certain things, with practicing numeracy skills and learning about AI. Points could be accumulated and exchanged for rewards."
m2rnxzgt5emd8-AIRH-536-1,A toy car that has an onboard computer which can control the car and give the child data and information about anything in general.
m2rnxzgt5emd8-AIRH-536-2,A wheel barrow that is connected to an Ipad can control the wheelbarrow and give the child data about any subject matter.
m2rnxzgt5emd8-AIRH-536-3,A desk with wheels that is controlled by a cellphone app so that the desk can be moved by the app and the child can do mathematical equations on the cellphone.