"uniqueIndex","idea"
"lzmevaovgfuua-AIRHUT-44","An augmented reality adventure set for children, equipped with a headset or tablet. The children will need to complete quests that require physical movement an problem solving. There will be many challenges to complete to encourage mobility and computation."
"lzmevh0yglq3x-AIRHUT-44","Robot Treasure Hunt: A programmable robot controlled with a that unblocks paths in a physical maze by solving math or logic puzzles."
"lzmevh0yglq3x-AIRHUT-44","Math Racing Cars: Racing cars with sensors and checkpoints on a track that present math problems. Solve these problems to move up."
"lzmevh0yglq3x-AIRHUT-44","Interactive Coding Ball: A smart ball with sensors and a coding interface. Kids program the ball to perform tricks, using mathematical patterns and logic, enhancing computational skills through physical play."
"lzmewomwtqrkv-AIRLHD-47","A steering wheel with a screen in the middle which has functionality that mimics a laptop. In the laptop feature there can be word and number games and age appropriate music."
"lzmewomwtqrkv-AIRLHD-47","A mini vehichle duplicate with a screen on the mini dashboard. The screen functions and has games of all sorts."
"lzmewomwtqrkv-AIRLHD-47","A multipart car toy that is remotely controlled by the user by tablet or smartphone and has a mini computer built into the car. The user can drive the car around remotely."
"lzmewvg4jy5xx-AIRHHD-48","A walker with 3 bars running around it forming concentric semi-circles. The bars are filled with beads that can be moved. Behind the bars, on the walker frame are numbers and pictures of animals"
"lzmewvg4jy5xx-AIRHHD-48","A game that calculates the number if exercises completed correctly. A number is shown - of points needed. The points must be exact. It show 5 exercises and allocated points for each, the player must then quickly work out how many reps of each to reach the goal. It will get progressily harder"
"lzmewvg4jy5xx-AIRHHD-48","Car park game - small. plastic cars with a number of each. The board has parking areas. There are cards which are turned-showing how many cards can be parked, and what is the total amount that the numbers on the top can show. They then drive the cars to their parking spots - ensuring the numbers add up to the correct amount"
"lzmewvt1rghj6-HMNLUT-49","Introducing, 'CarOBoat', the first-of-its-kind toy that combines the features of a Boat and a Car. The CarOBoat can be used in water and on land for unlimited fun activities. Kids can use the same toy to play on land and water. With retractable wheels, it is more convenient to play with the same toy on different surfaces."
"lzmewvt1rghj6-HMNLUT-49","The 'CaBoTransformer' is the latest innovative robot that can transform between a Boat and a Car all with the press of a hidden button. It's ideal for kids who want the best of both worlds. By pressing the hidden switch, the Transformer Robot opens up, giving the kids the option to twist, turn and make the robot into a car or boat whichever they choose."
"lzmewvt1rghj6-HMNLUT-49","Bocar Puzzle Box is rated as one of the best kid-friendly puzzle boxes. It helps kids solve the puzzle to reveal the hidden Boat / Car. Better yet, with the given timer, it makes it even better; now kids can play Co-op taking turns and finding out who can solve the puzzle faster. Having more than 25 different ways to solve the puzzle will help kids hooked up for hours."
"lzmex1mdqkb2u-HMNHUT-50","A toy that can be used in a pool to help the child stay afloat. -This will assist the child to move physically without the help of an adult -It will also enable them to float in the water by wearing it on their legs,arms or neck. -It will however also require them to test their own cognitive ability by moving themselves and thinking about how they can make that happen. They will learn from experience and learn what the best way is to move forward -This all requires the child to be submerged in water"
"lzmex1mdqkb2u-HMNHUT-50","A mini lifeboat that can be used in a pool and in the sea(under the supervision of an adult) - The child would be able to move themselves physically and manually by rowing or padelling. - This creates a real life situation, of being a lifeguard and it gets them thinking about what they could do to save someones life and how it feels. A doll could accompany the boat so that an adult can throw it on the far end of a pool and the child should be tasked to go and fetch it -This would allow them to think for themselves about how to get their as quickly and safely as possible. The boat would float but they would be in control"
"lzmex1mdqkb2u-HMNHUT-50","A bath time toy - The toy itself would be floating -The child would con"
"lzmexr7zcoca7-HMRLUT-51","A toy which combines helps children with increase their cognitive ability could be a remote-controlled car. The car which is powered by a battery can be controlled and moved with a computer that illustrates a remote control. This concept allows children to understand the different buttons and use their problem solving skills to work-out a solution."
"lzmexr7zcoca7-HMRLUT-51","Another idea could be using a small interactive device where there is a screen and a small steering wheel on the top and mimics a car game where there are obstacles and by using the steering wheel you are able to avoid them. This is a simplified minigame similar to driving game to allow children to learn from the initial experience of dodging the cars and learn to use the steering wheel quickly increasing their cognitive ability."
"lzmexr7zcoca7-HMRLUT-51","Similar to the previous one, an idea that combines both a car and computer would be a makeshift car seat, with a steering wheel and a low quality screen that would display and mimics a race on a track. Similar to the ones you would find at an arcade game, this small one for children would use both the breaks and accelerator to drive the car for a race in the game. Children would have to multitask and use their problem solving skills to understand which pedal corresponds with which action as well as learn quickly as it a racegame."
"lzmeym81o4ef8-HMRHUT-52","A large magnetic interactive times tables board (that fills a whole wall) Children can place the answers on the board (it is large enough to encourage movement) The board is very colourful to be appealing to the children, and the game comes with a timer for a competitive element to pay with siblings and friends."
"lzmeym81o4ef8-HMRHUT-52","An outdoor golf game which encourages the children to count their scores on a score card. The game can be set up in a small or large garden, or even indoors and can be played with the whole family. The game combines movement and maths calculations."
"lzmeym81o4ef8-HMRHUT-52","A discovery card game which involves finding a certain number of items. e.g. find 5 shells on the beach.The game can be played at home or on holiday. The game encourages children to explore and count items. At the end, they will count their total number of items. The game can be played alone or with friends and family and is good for travel."
"lzmeyoy3dbgqh-HMNLHD-53","A toy that when it touches water the wheels fold inward and create propellers for the toy so the child can use it on both land and water"
"lzmeyoy3dbgqh-HMNLHD-53","Have a toy that looks like a car but can be detached. Once detached items can be rearranged to make a boat that can drive on water"
"lzmeyoy3dbgqh-HMNLHD-53","Have a car with items in its boot that can be taken out to assemble a boat so the 2 items can be used at once"
"lzmf18kge502l-HMRLHD-55","The Kit-Car - a Knight-rider style car that is capable of incredible feats such as flight, instant turns, and defensive weaponry that allows your child to be the worlds greatest spy"
"lzmf18kge502l-HMRLHD-55","An auto-drive car that takes groups of children on educational excursions around the city-country-continent. Essentially, the ultimate school trip, where the car takes the role of both supervisor and teacher, and students experience and learn about all the places and cultures they visit!"
"lzmf18kge502l-HMRLHD-55","The Child-Care-Car that entertains and teaches your child as the parents drive. While you focus on the destination, the car focuses on keeping your kids occupied with fruitful and worthwhile experiences."
"lzmf1w3ta5h7x-HMRHHD-56","The first idea is like a transformer. There are wheels on some of the parts/blocks to allow for movement. The toy comes with multiple cards showing items it can be transformed into (a car, a robot, a spaceship) by changing around the parts. The building and connections will involve a mathematical element, using basic addition/subtraction/number recognition to find which pieces go together. Pieces will have a corresponding number (either written or colour coded). So for example combine two 5s to make a head."
"lzmf1w3ta5h7x-HMRHHD-56","A handheld computer (about the size of a gameboy or remote control) with a car or other vehicle connected to it. The child must solve math sums to get the car to move (either certain sums equate to certain movement or by building up a number of correct answers to get a certain number of moves). The difficulty can be altered to allow for children getting older and having better math skills (e.g. age 5 mode basic addition and subtraction, but age 10 mode including larger numbers or multiplication/division."
"lzmf1w3ta5h7x-HMRHHD-56","A car with wheels that are """"locked"""" until you put certain small pieces into holes in the car to enable movement. Which small piece will correspond to maths puzzles on cards. The small pieces will be numbered and the cards will have a picture of the location of the hole and you have to complete the sum on the card to find out which numbered piece to use."
"lzmfh7ueinv9x-AIRLUT-59","An eductaional toy car that teaches kids about cars and the mechanics behind it. How cars are manufactured etc -This would be particularly useful forchildren that would be interested in this career field etc -A mini toy car that has a built in computer screen that would be used for educational purposes. -The computer could have educational videos that makes learning about cars fun. -This would expand their cognitive ability and help them learn quickly about it. -lots of videos about how cars are made should be included -information about the software in the vehicle might be interesting to older children above the age of 10"
"lzmfh7ueinv9x-AIRLUT-59","A toy computer that is shaped as a car -This would be ideal for children on the younger end of the spectrum of ages 5-11, since it will be able to speak to them and ask questions in a way they can understand -It would be something they can fold up, pack in their bags and take with them wherever they go. -Their could also be built-in quizzes and puzzles etc that would interest children between those ages"
"lzmfh7ueinv9x-AIRLUT-59","Lastly, a computer/video game -This game would be all about cars -designing your own cars and being able to drive them to the grocery store, garage and even perform a car wash. -it would not be the typical car racing video game but more like SIMS4CARS -They would be able to purchase new features, perform tasks that would earn them coins so they can purchase things for the cars and even purchase new cars. -they could take on the role of car enthusiasts, have their own garage workshops and make money by fixing cars. -this would be a real-life simulation game"
"lzmflzbshx9y6-AIRHUT-60","i would design a robot that reacts to humans chasing it around. So a child would chase it and when it got within a short distance of it the robot would quickly move keeping the child on it's toes and therefore helping itbto keep fit"
"lzmflzbshx9y6-AIRHUT-60","you could design a robot that walks around with a child and only interacts when its moving, again keeping a child fit. The robot would then interact with the child asking it questions on different topics. At the end the robot could tell the child how many steps it has taken, how many calories burned and how well they did on the questions"
"lzmflzbshx9y6-AIRHUT-60","i would design a robot that shows video clips of dance routines and fitness goals and once the child perfects the routines or hit fitness goals or even gets so many questions right then they earn points to spend instore or online to play other games"
"lzmgaftmp3yvy-AINHHD-62","""""Aqua Adventure"""": a multisensory floatation toy. Combining floatation device and integrated interactive waterproof screen presents different activities."
"lzmgaftmp3yvy-AINHHD-62","SwimPal is an interative float that contains pool game euipment including balls, a net, nerf toys and more"
"lzmgaftmp3yvy-AINHHD-62","Wave rider rings are colourful textured hoops that kids swim through, improving mobility and swimming skills through fun, active play"
"lzmgkuagfv33b-AIRLHD-63","The first toy is a car with a computer, however, this car comes with a series of magnet nodes (also disguised as accessories) like trees, animals, traffic lights, buildings, and so on. Each of these accessories has a small array of powerful magnets in specific orientations. The car has a series of electromagnetic sensors and recognizes each unique node/accessory. Each node corresponds with a different command recognized by the computer (e.g., turn left, speed up, do a doughnut, honk, etc). The child plays with the toy by arranging the nodes to produce behavior in the car."
"lzmgkuagfv33b-AIRLHD-63","This is a small handheld car with a computer, and a corresponding app. The child can play with the toy by pushing it around the house (or any given location). The car automatically maps the location and sends this information to the app. The child can then access the map in the app. Hereafter, the car self-drives around the mapped location, but the child must use the app to try and chase the car (with monsters, or other cars or some silly bullshit like that). The child will watch the car drive around their house, and the car will announce what it's doing """"Oh no, the monsters nearly got me"""", """"Look out, there a parade of fascists over there that represent a serious threat to democracy and decency, I better go collect that minority individual on the other side of the street and drive them to safety"""" and so on. (Or, you know, whatever kids think about)."
"lzmgkuagfv33b-AIRLHD-63","Car + computer, etc. This is a remote controlled toy with an app. The child drives it around outside. Much like the mars rover, it is taking readings of the environment in real time - temperature, humidity, soil quality, and other things. It then provides recommendations for how to interact and look after the environment. """"Car detects the scent of a fox. Look around for local wildlife"""" """"Car detects unacceptable levels of heavy metals, leave the area immediatly and inform your local environmental authority"""" etc."
"lzmglknumpcri-AIRHHD-64","a jump maths mat - the mat has sections with numbers and patterns - the visual prompts make the child jump on the correct answer"
"lzmglknumpcri-AIRHHD-64","robot build racer - assemble a car with easy to connect parts - allowing coding to learn and small motor skills to create"
"lzmglknumpcri-AIRHHD-64","maths treasure quest - sturdy plastic treasure chests and coins with maths symbols and numbers - solving puzzles opens the correct chests to receive more coins to make harder puzzles"
"lzmgltmuxahj6-HMNLUT-65","A car that becomes a boat when in water. The wheels lift up and become part of the boat. The cognitive part of the toy is how the wheels will fit smoothly into the underside of the boat."
"lzmgltmuxahj6-HMNLUT-65","A boat that can temporarily drop wheels down to travel over low water areas where the land is very close to the surface. The cognition is using your judgement to know when this is needed. Without this the bottom of the boat will become damaged and travel will not be possible."
"lzmgltmuxahj6-HMNLUT-65","A large boat which has small vehicles aboard that are used to move from one area to another. Not all areas will be accessible. The cognition will be designing parts of the boat to be as user friendly and accessible as possible. Similar to making a place accessible for disabled people and wheelchairs."
"lzmgm0c92iy2g-HMRLUT-67","A little robot car - it would have a look of a robot, but functionality of the car. There could be a lot of buttons that would include Space for jumping, Enter for moving and Esc for making a """"Goodbye sound."
"lzmgm0c92iy2g-HMRLUT-67","It could be lego that would include car and computer. Kid would be able to build a little office space where they would have a little toy person that would arrive to the office in their car and they could then go to the office to work on a computer."
"lzmgm0c92iy2g-HMRLUT-67","This could be a tablet style of computer that would have a wheels and have a remote control. So that kid can either play games on the tablet or send it somewhere else by using the remote control for the tablet."
"lzmgnwy8k36m7-HMNLHD-69","a large boat designed for carrying smaller cars across imaginary rivers/oceans, see how many cars you can fit into the boat , choose your favourite cars to take on a journey"
"lzmgnwy8k36m7-HMNLHD-69","cars vs boats , similar to battleships but this time it is different cool boats vs different cool cars on each side"
"lzmgnwy8k36m7-HMNLHD-69","a toy car that can has wheels that can drive but then with a touch of a button it becomes a boat that can float on water."
"lzmgny4xwl514-HMNHHD-70","Floating pedalo for non-swimmers. An inflatable ring with a pedal function. The child can safely sit in the seat of the ring whoch is a secure flotation device, but there is a rotating pedal function to allow them to move around the pool using their feet. This can strentgthen leg muscles, provide fun, and be used by non-swimmers."
"lzmgny4xwl514-HMNHHD-70","A floating arm-cycle. This is harnessed onto the child across the back, with arm rests and then a cycle powered by their arms/hands. The cycle has small paddles enabling them to move around the water powered by arm cycling."
"lzmgny4xwl514-HMNHHD-70","An inflatable float with flippers attached. the child holds the float with their arms to float upper body and the attached flippers powered by their feet to move around the water."
"lzmgo5ktbs8cj-HMRLHD-71","a remote control car which can be programmed to complete different routes and have different sound effects, lights and noises"
"lzmgo5ktbs8cj-HMRLHD-71","a computer which simulates the feeling of driving a car. it can be programmed to drive on different terraines an differnt places."
"lzmgo5ktbs8cj-HMRLHD-71","a computer which aids the design of a toy car which the child can build and contruct themselves. design freedom."
"lzmgp3yx6vi4q-AINLUT-73","Have a car with the boat with a hole for the car to fit into so it can float and be use as car and needs to be fitted together"
"lzmgp3yx6vi4q-AINLUT-73","The toy can switch between a car and a boat, parts are able to be removed and added to change the function of the toy. The child has to decide what configuration is best suited for the type of play."
"lzmgp3yx6vi4q-AINLUT-73","The toy comes with a dock/garage where once in areas of the toy can be unlocked to add/replace a new module which will change the function of the toy between land an water configurations"
"lzmgpebtkt7ly-AINHUT-74","a floating lego toy to be played during bathtime. ideally the pieces should be big enough so that it will not be a choke hazard. kids can try to create shapes/structures while bathing"
"lzmgpebtkt7ly-AINHUT-74","create a water maze with floatable pieces. kids can try to navigate it with remote controlled water crafts, these water crafts can be built with lego technic or bought readymade from store"
"lzmgpebtkt7ly-AINHUT-74","a snakes and ladders game for bathtime. the dice should be floatable but they have to use a water gun to move the pieces by shooting water at it"
"lzmgqfg39m97z-AIRLUT-75","a car set up like a mechanics garage where the child works with the computer to diagnose problems and repair the car"
"lzmgqfg39m97z-AIRLUT-75","computer software to allow design of multiple combinations of car parts. The child then builds the toy, while learning about about reuse and recycling and produces multiple toy options from the same parts."
"lzmgqfg39m97z-AIRLUT-75","a voice controlled car where the child learns to give directions and instructions such as distance and angles to turn"
"lzmgr563cdee7-AIRHUT-76","Mini Tesla solar-powered games console that allows the more inquisitive child to take quick trips to Mars and back to visit Muskland. Back home in time for tea and cake."
"lzmgr563cdee7-AIRHUT-76","Solar panelled full body costume (designed to be the super-hero of your choice) that is equipped with plutonium powered computer technology. Trouble is - only works when the sun shines. Solve that problem kids!"
"lzmgr563cdee7-AIRHUT-76","Mummy and daddy won’t let you have a pet? They’ll have to when they see what you brought homew from school! The totally interactive herd of buffalo (you ride ahead on the lead buffalo) driven by AI technology. Flattens all people and neighbourhoods it encounters! Hey kids - who do you want to see under a stampede?! (Only do this at home.)"
"lzmgrjfsfw0ym-AINLHD-77","Magnetic transforming boat/car. Interchangeble pieces to design the child's idea of a boat/car. The boat always floats on water and the wheels of the car retract."
"lzmgrjfsfw0ym-AINLHD-77","Rescue Rover and boat combo. The toys click together to form one vehicle but can be disconnected to play with separately."
"lzmgrjfsfw0ym-AINLHD-77","Water toy that floats on the water. The wheels retract when the toy is on water. The wheels automatically pop out when on ground."
"lzmgrsakrr0ed-AIRLHD-79","An Electric car with a built in computer system that can integrate advanced navigation and enhanced safety features so that children can safely drive even without parental supervision."
"lzmgrsakrr0ed-AIRLHD-79","A computer programmed remote control car that integrates programmable software which enables customization of car behavior, such as creating preset paths, implementing obstacle avoidance and with autonomous driving features."
"lzmgrsakrr0ed-AIRLHD-79","Smart Track Racer kit, that includes toy cars equipped with sensors and a track featuring embedded, programmable LEDs. The Cars can be controlled using a tablet or smartphone app where kids can program their routes, speeds and even create racing."
"lzmgsnd911gyz-HMNHUT-82","This toy will combine the connective properties of a child's construction set similar to a lego or mechano set and those of a pool floatation device similar to a pool noodle. This will allow the child to construct simple or intricate forms to play and interact with in the pool."
"lzmgsnd911gyz-HMNHUT-82","This toy re-imagines the pedal boat as a modular design. Each buoyant section can be interlocked in a range of configurations allowing the rider to design a boat with differing designs. If combined with a friend's set the boats can become more intricate and have multiple drivers propelling the vehicle."
"lzmgsnd911gyz-HMNHUT-82","This toy, named """"Swim mates"""", will be a collectable form of floatation device focused on cute anime monster characters. Each will have a quirky """"super skill"""" such as a water gun, bubble maker, horn blast, wave maker etc. and come with wearable accessories such as armbands, goggles, swim hats, ankle ropes that match each creature. These could be sold separately."
"lzmgt14xglcbz-HMRLUT-83","My first idea is a car toy that has a computer inbuilt into it. It is a small pocket car shaped toy, and the computer is hidden behind the car's window screen. The car can move by itself, taking the child on a different 'adventure' each day, to learn something new. The computer knows what the weather is like on each day, and if it's appropriate for the child to be inside or out. The adventures are taught like lessons, introducing the child to new ideas and building on lessons learnt the day before e.g. learning about plant identification one day, and photosynthesis the next."
"lzmgt14xglcbz-HMRLUT-83","The second idea is a computer that is shaped like a car, but remains static. The car shape makes the computer engaging to the child and hosts a number of cognitive ability, interactive games that the child can play each day. The car shape gives the computer personality, and helps the child to engage."
"lzmgt14xglcbz-HMRLUT-83","The third idea is a self driving car that hosts a computer specifically designed to teach children about the world, with a focus on the natural world, meditation and humans place in nature. It would take the child on a tour of these locations, where they would remain inside th vehicle, and tour each of these locations. The computer would engage the child in complex, philosophical discussions about the world around them to get them to think abstractly."
"lzmgtypmj06df-HMNLHD-85","Complete combination of the main functions of these two toys, i.e. a car-boat. With the shape of a boat, but with wheels, this new vehicle would be able to float in the water, yet wheel around, or 'be driven' when on land. Working wheels would be attached to the bottom of the boat, which can be used on land when the child wants. -For example, on an island which the child finds whilst sailing."
"lzmgtypmj06df-HMNLHD-85","Both the car and the boat would have a hook for pulling on the front, and a hoop which the hook can be slotted into on the back. The child can take turns using either vehicle to pull the other during their imaginative play."
